{
  "agent": "iso-audit",
  "audit_date": "2026-06-25",
  "auditor": "KI-Agent",
  "overall_pass": false,
  "scope": "Nextcloud 31.0.2-apache Docker-Stack auf Debian x86_64, Traefik Frontdoor, Postgres 16.6 + Redis 7.4, OIDC via Keycloak",
  "evidence": {
    "E1_asset_inventory": {
      "pass": true,
      "findings": [
        {"test": "Container-Inventar", "result": "3 Services: nextcloud-app (nextcloud:31.0.2-apache), nextcloud-postgres (postgres:16.6-alpine), nextcloud-redis (redis:7.4-alpine)", "status": "ok"},
        {"test": "Volume-Inventar", "result": "5 Volumes: nextcloud-html, nextcloud-config, nextcloud-apps, postgres-data, redis-data", "status": "ok"},
        {"test": "Netzwerk-Inventar", "result": "2 Netzwerke: web (external, Traefik) + internal (isolated backend)", "status": "ok"},
        {"test": "Config-Dateien", "result": "8 Artefakte: docker-compose.yml, env.template, traefik-dynamic.yml, init.sh, redis.conf, redis-users.acl.tmpl, backup.sh, healthcheck-monitor.sh", "status": "ok"},
        {"test": "Secrets-Referenzen", "result": "6 Secrets via ${VAR}: DB_PASSWORD, NEXTCLOUD_ADMIN_USER, NEXTCLOUD_ADMIN_PASSWORD, OIDC_CLIENT_ID, OIDC_CLIENT_SECRET, REDIS_PASSWORD", "status": "ok"},
        {"test": "Betriebssystem", "result": "Debian x86_64, 4 CPUs, 8GB RAM (laut input.json)", "status": "ok"},
        {"test": "Domains", "result": "cloud.example.com (Nextcloud), auth.example.com (Keycloak OIDC)", "status": "ok"}
      ],
      "source": "docker-compose.yml, docker volume ls, docker network ls, input.json, blueprint-output.json"
    },
    "E2_access_control": {
      "pass": true,
      "findings": [
        {"test": "Rate-Limiting Traefik", "result": "Middleware nextcloud-ratelimit: average:10 burst:20", "status": "ok"},
        {"test": "DB-Benutzerrechte", "result": "User nextcloud mit LOGIN PASSWORD via init.sh erstellt, GRANT ALL PRIVILEGES ON DATABASE nextcloud", "status": "ok"},
        {"test": "Redis ACL", "result": "ACL-File mit user default >${REDIS_PASSWORD} ~* &* +@all via users.acl.tmpl", "status": "ok"},
        {"test": "Admin-Accounts via Secrets", "result": "NEXTCLOUD_ADMIN_USER und NEXTCLOUD_ADMIN_PASSWORD als ${VAR} gesetzt, keine Klartext-Credentials", "status": "ok"},
        {"test": "Default-Accounts deaktiviert", "result": "Nur explizit definierte Rolle nextcloud in postgres, kein weiterer DB-User", "status": "ok"},
        {"test": "OIDC-Rollenexport", "result": "Nicht verfuegbar (Live-Keycloak-Zugriff erforderlich fuer Realm-Export)", "status": "warning"},
        {"test": "Nextcloud-User-Liste", "result": "Nicht enumerierbar ohne Live-System (occ user:list benoetigt Container-Zugriff)", "status": "warning"}
      ],
      "source": "docker-compose.yml, init.sh, redis-users.acl.tmpl, traefik-dynamic.yml, env.template"
    },
    "E3_authentication": {
      "pass": false,
      "findings": [
        {"test": "OIDC-Integration (Keycloak)", "result": "sociallogin App mit custom_oidc Provider, Issuer https://auth.example.com/realms/master, Client-ID/Secret via ${VAR}", "status": "ok"},
        {"test": "Brute-Force-Schutz (Rate-Limit)", "result": "Traefik RateLimit Middleware average:10 burst:20 global, kein spezifischer Auth-Endpoint-RateLimit", "status": "warning"},
        {"test": "MFA / 2FA", "result": "Keine Evidenz: weder Keycloak OTP-Flow noch Nextcloud 2FA-App (twofactor_totp) konfiguriert", "status": "fail", "fix": "Keycloak: OTP-Required-Action im Authentication-Flow aktivieren, Nextcloud: twofactor_totp App installieren"},
        {"test": "Passwort-Policy", "result": "Keine Evidenz: weder Keycloak-Password-Policy noch Nextcloud password_policy App konfiguriert", "status": "fail", "fix": "Keycloak Realm: Password Policy (min. 12 Zeichen, Sonderzeichen) setzen. Nextcloud: password_policy App aktivieren"},
        {"test": "Passwort-Rotation", "result": "Kein Passwort-Rotations-Log oder Ablaufdaten dokumentiert", "status": "fail", "fix": "Passwort-Richtlinie mit max. 90-Tage-Rotation definieren und Log fuehren"},
        {"test": "Auth-Endpunkt-Haertung", "result": "Disable-Registration=true bei OIDC gesetzt, keine Self-Registration", "status": "ok"}
      ],
      "source": "deploy_steps Step 7 (oidc_configure), traefik-dynamic.yml, Keycloak-Authentication-Flow (nicht verfuegbar)"
    },
    "E4_cryptography": {
      "pass": true,
      "findings": [
        {"test": "TLS-Protokoll", "result": "minVersion: VersionTLS12, TLS 1.3 via Traefik implizit unterstuetzt", "status": "ok"},
        {"test": "Cipher Suites", "result": "TLS_ECDHE_ECDSA/RSA_WITH_AES_256_GCM_SHA384, AES_128_GCM_SHA256, CHACHA20_POLY1305 (Modern)", "status": "ok"},
        {"test": "Zertifikats-Provider", "result": "ACME via Let's Encrypt (acme@example.com, Production CA, nicht Staging)", "status": "ok"},
        {"test": "HSTS-Header", "result": "stsSeconds:63072000, stsIncludeSubdomains:true, stsPreload:true, forceSTSHeader:true", "status": "ok"},
        {"test": "sniStrict", "result": "true (kein Fallback auf Default-Zertifikat)", "status": "ok"},
        {"test": "Security-Headers", "result": "X-Frame-Options:SAMEORIGIN, X-Content-Type-Options:nosniff, Referrer-Policy:strict-origin-when-cross-origin, X-Robots-Tag:noindex,nofollow", "status": "ok"},
        {"test": "Private-Key-Zugriff", "result": "ACME-Keys werden von Traefik verwaltet; kein direkter Dateizugriff im Blueprint vorgesehen", "status": "ok"},
        {"test": "OIDC-Endpunkte", "result": "Alle OIDC-URLs (Issuer, Redirect-URI) via https://", "status": "ok"}
      ],
      "source": "traefik-dynamic.yml, input.json acme-Sektion, traefik TLS-Optionen modern"
    },
    "E5_change_management": {
      "pass": true,
      "findings": [
        {"test": "Deploy-Prozess", "result": "8 idempotente Schritte: Preflight → env_validate → Volumes → Pre-Deploy-Backup → Deploy (sequentiell) → Verify → OIDC → Drift-Snapshot", "status": "ok"},
        {"test": "Rollback-Prozess", "result": "5 Schritte: Stop → Data-Restore (pg_restore) → Config-Rollback (git checkout) → Redeploy → Verify", "status": "ok"},
        {"test": "Drift-Erkennung", "result": "Taeglicher Cron: diff docker compose config vs .docker-compose-reference.yml", "status": "ok"},
        {"test": "Update-Strategie", "result": "Dokumentiert fuer Nextcloud Major, Postgres Major, Patch-Updates (docker compose pull)", "status": "ok"},
        {"test": "Git-History", "result": "Nicht pruefbar ohne Repository-Zugriff (47 Commits laut Phase 6 Template, aber unbelegt)", "status": "warning"},
        {"test": "Staging-/Testumgebung", "result": "Keine dokumentiert. Kein Testprotokoll ausserhalb der deploy_steps-Validierung", "status": "warning"},
        {"test": "Commit-Message-Konvention", "result": "Nicht verfuegbar ohne Git-Zugriff", "status": "warning"}
      ],
      "source": "deploy_steps, rollback_steps, drift_detection, update_strategy im blueprint-output.json"
    },
    "E6_capacity_management": {
      "pass": true,
      "findings": [
        {"test": "CPU/Memory-Limits (Nextcloud)", "result": "limits: cpus=2, memory=1Gi; reservations: cpus=1, memory=512Mi (Spec resources)", "status": "ok"},
        {"test": "CPU/Memory-Limits (Postgres)", "result": "limits: cpus=1, memory=512M; reservations: cpus=0.25, memory=256M", "status": "ok"},
        {"test": "CPU/Memory-Limits (Redis)", "result": "limits: cpus=1, memory=512M; reservations: cpus=0.25, memory=128M", "status": "ok"},
        {"test": "Redis maxmemory", "result": "256mb, maxmemory-policy: allkeys-lru", "status": "ok"},
        {"test": "Aktuelle Ressourcen-Nutzung", "result": "Keine Live-Metriken (docker stats) verfuegbar — kein Deployment-Zugriff", "status": "warning"},
        {"test": "Volume-Groessen", "result": "Nicht bekannt ohne Zugriff auf Deployment (docker run df -h /vol)", "status": "warning"},
        {"test": "Kapazitaetstrends", "result": "Kein Monitoring-Dashboard oder Trend-Analyse dokumentiert", "status": "warning"}
      ],
      "source": "docker-compose.yml deploy.resources, redis.conf, spec-output.json resources"
    },
    "E7_backup_restore": {
      "pass": false,
      "findings": [
        {"test": "Backup-Script", "result": "backup.sh mit pg_dump + Volume-tar (config, custom_apps), 7-Tage-Retention via BACKUP_RETENTION_DAYS", "status": "ok"},
        {"test": "Backup-Zeitplan", "result": "Taeglich via Cron (in Blueprint-Assumptions referenziert, kein Cron-Job-Artefakt)", "status": "warning"},
        {"test": "DB-Dump", "result": "pg_dump -U nextcloud nextcloud → SQL-Dump in Backup-Verzeichnis", "status": "ok"},
        {"test": "Restore-Prozedur", "result": "Rollback Step 2: pg_restore aus letztem Dump dokumentiert", "status": "ok"},
        {"test": "Backup-Umfang — User-Daten", "result": "NICHT gesichert: /var/www/html/data (User-Files) fehlt im backup.sh — nur config und custom_apps gesichert", "status": "fail", "fix": "backup.sh um /var/www/html/data erweitern oder separates nextcloud-data Volume definieren und sichern"},
        {"test": "Restore-Test-Protokoll", "result": "Kein DR-Test oder Restore-Test dokumentiert (Ops-Agent next_action Priority 3)", "status": "fail", "fix": "Quartalsweisen End-to-End-Restore-Test mit RTO/RPO-Messung durchfuehren und protokollieren"},
        {"test": "Backup-Integritaet", "result": "Keine Integritaetspruefung (gzip -t, sha256sum) im backup.sh vorgesehen", "status": "warning"},
        {"test": "Pre-Deploy-Backup", "result": "Step 4: automatischer Pre-Deploy-Snapshot via backup.sh, falls Stack laeuft", "status": "ok"}
      ],
      "source": "backup.sh, rollback_steps, ops-output.json warnings"
    },
    "E8_logging": {
      "pass": false,
      "findings": [
        {"test": "Docker Log Driver", "result": "json-file fuer alle 3 Services konfiguriert", "status": "ok"},
        {"test": "Log-Rotation", "result": "max-size:10m, max-file:3 fuer alle 3 Services", "status": "ok"},